{"details":{"checked_pairs":6,"defect":6,"violations":[{"dot":4,"rows":[0,1]},{"dot":4,"rows":[0,2]},{"dot":4,"rows":[0,3]},{"dot":4,"rows":[1,2]},{"dot":4,"rows":[1,3]},{"dot":4,"rows":[2,3]}]},"improvement":"0/1","problem_id":"hadamard-mini","reason":"NOT_STRICT_IMPROVEMENT","recomputed_at_commit":"local-dev","score":"6/1","solution_hash":"sha256:50cff8e635f2a39742288724dd690d067c60be43ad29eda01528274d178c4b44","valid":false,"verifier_image":"sha256:local-dev","verifier_version":"0.1.0"}
