{"details":{"checked_pairs":6,"defect":0,"violations":[]},"improvement":"1/1","problem_id":"hadamard-mini","reason":"","recomputed_at_commit":"local-dev","score":"0/1","solution_hash":"sha256:4771e6e4e18ebecb9f4f74f9849f69b784319256d8bd4d04c9f62164a9cdb1b7","valid":true,"verifier_image":"sha256:local-dev","verifier_version":"0.1.0"}
